,context,dominant_topic,perc_contribution,topic_keywords
96,level trace get trace level get trace level level level get field trace get null exception ex level trace level level get field trace get null level trace logger logger logger get logger org apache log j formatter test log sf tear down log manager reset configuration test name array writer writer array writer pattern layout layout pattern layout c writer appender appender writer appender layout writer appender activate options logger get root logger add appender appender log sf debug logger null math pi equals test log sf get name writer to string test trace null pattern log capture capture log capture trace logger set level trace log sf trace logger null math pi null capture get message test trace no arg log capture capture log capture trace logger set level trace log sf trace logger hello world math pi equals hello world capture get message test trace bad pattern log capture capture log capture trace logger set level trace log sf trace logger hello math pi equals hello capture get message test trace missing arg log capture capture log capture trace logger set level trace log sf trace logger hello world object equals hello world capture get message test trace string log capture capture log capture trace logger set level trace log sf trace logger hello world equals hello world capture get message test trace null log capture capture log capture trace logger set level trace log sf trace logger hello object null equals hello null capture get message test trace log capture capture log capture trace logger set level trace val log sf trace logger iteration val equals iteration capture get message test trace log capture capture log capture trace logger set level trace val log sf trace logger iteration val equals iteration capture get message test trace log capture capture log capture trace logger set level trace val log sf trace logger iteration val equals iteration capture get message test trace log capture capture log capture trace logger set level trace val log sf trace logger iteration val equals iteration capture get message test trace log capture capture log capture trace logger set level trace val c log sf trace logger iteration val equals iteration c capture get message test trace log capture capture log capture trace logger set level trace val true log sf trace logger iteration val equals iteration true capture get message test trace log capture capture log capture trace logger set level trace val f log sf trace logger iteration val equals iteration string value of val capture get message test trace log capture capture log capture trace logger set level trace val log sf trace logger iteration val equals iteration string value of val capture get message test trace two arg log capture capture log capture trace logger set level trace log sf trace logger hello world equals hello world capture get message test trace three arg log capture capture log capture trace logger set level trace log sf trace logger hello world equals hello world capture get message test trace four arg log capture capture log capture trace logger set level trace log sf trace logger hello world equals hello world capture get message test trace array arg log capture capture log capture trace logger set level trace object args object hello world log sf trace logger args equals hello world capture get message test trace null array arg log capture capture log capture trace logger set level trace object args null log sf trace logger args equals capture get message test debug null pattern log capture capture log capture level debug log sf debug logger null math pi null capture get message test debug no arg log capture capture log capture level debug log sf debug logger hello world math pi equals hello world capture get message test debug bad pattern log capture capture log capture level debug log sf debug logger hello math pi equals hello capture get message test debug missing arg log capture capture log capture level debug log sf debug logger hello world object equals hello world capture get message test debug string log capture capture log capture level debug log sf debug logger hello world equals hello world capture get message test debug null log capture capture log capture level debug log sf debug logger hello object null equals hello null capture get message test debug log capture capture log capture level debug val log sf debug logger iteration val equals iteration capture get message test debug log capture capture log capture level debug val log sf debug logger iteration val equals iteration capture get message test debug log capture capture log capture level debug val log sf debug logger iteration val equals iteration capture get message test debug log capture capture log capture level debug val log sf debug logger iteration val equals iteration capture get message test debug log capture capture log capture level debug val c log sf debug logger iteration val equals iteration c capture get message test debug log capture capture log capture level debug val true log sf debug logger iteration val equals iteration true capture get message test debug log capture capture log capture level debug val f log sf debug logger iteration val equals iteration string value of val capture get message test debug log capture capture log capture level debug val log sf debug logger iteration val equals iteration string value of val capture get message test debug two arg log capture capture log capture level debug log sf debug logger hello world equals hello world capture get message test debug three arg log capture capture log capture level debug log sf debug logger hello world equals hello world capture get message test debug four arg log capture capture log capture level debug log sf debug logger hello world equals hello world capture get message test debug array arg log capture capture log capture level debug object args object hello world log sf debug logger args equals hello world capture get message test debug null array arg log capture capture log capture level debug object args null log sf debug logger args equals capture get message test info null pattern log capture capture log capture level info log sf info logger null math pi null capture get message test info no arg log capture capture log capture level info log sf info logger hello world math pi equals hello world capture get message test info bad pattern log capture capture log capture level info log sf info logger hello math pi equals hello capture get message test info missing arg log capture capture log capture level info log sf info logger hello world object equals hello world capture get message test info string log capture capture log capture level info log sf info logger hello world equals hello world capture get message test info null log capture capture log capture level info log sf info logger hello object null equals hello null capture get message test info log capture capture log capture level info val log sf info logger iteration val equals iteration capture get message test info log capture capture log capture level info val log sf info logger iteration val equals iteration capture get message test info log capture capture log capture level info val log sf info logger iteration val equals iteration capture get message test info log capture capture log capture level info val log sf info logger iteration val equals iteration capture get message test info log capture capture log capture level info val c log sf info logger iteration val equals iteration c capture get message test info log capture capture log capture level info val true log sf info logger iteration val equals iteration true capture get message test info log capture capture log capture level info val f log sf info logger iteration val equals iteration string value of val capture get message test info log capture capture log capture level info val log sf info logger iteration val equals iteration string value of val capture get message test info two arg log capture capture log capture level info log sf info logger hello world equals hello world capture get message test info three arg log capture capture log capture level info log sf info logger hello world equals hello world capture get message test info array arg log capture capture log capture level info object args object hello world log sf info logger args equals hello world capture get message test warn null pattern log capture capture log capture level warn log sf warn logger null math pi null capture get message test warn no arg log capture capture log capture level warn log sf warn logger hello world math pi equals hello world capture get message test warn bad pattern log capture capture log capture level warn log sf warn logger hello math pi equals hello capture get message test warn missing arg log capture capture log capture level warn log sf warn logger hello world object equals hello world capture get message test warn string log capture capture log capture level warn log sf warn logger hello world equals hello world capture get message test warn null log capture capture log capture level warn log sf warn logger hello object null equals hello null capture get message test warn log capture capture log capture level warn val log sf warn logger iteration val equals iteration capture get message test warn log capture capture log capture level warn val log sf warn logger iteration val equals iteration capture get message test warn log capture capture log capture level warn val log sf warn logger iteration val equals iteration capture get message test warn log capture capture log capture level warn val log sf warn logger iteration val equals iteration capture get message test warn log capture capture log capture level warn val c log sf warn logger iteration val equals iteration c capture get message test warn log capture capture log capture level warn val true log sf warn logger iteration val equals iteration true capture get message test warn log capture capture log capture level warn val f log sf warn logger iteration val equals iteration string value of val capture get message test warn log capture capture log capture level warn val log sf warn logger iteration val equals iteration string value of val capture get message test warn two arg log capture capture log capture level warn log sf warn logger hello world equals hello world capture get message test warn three arg log capture capture log capture level warn log sf warn logger hello world equals hello world capture get message test warn four arg log capture capture log capture level warn log sf warn logger hello world equals hello world capture get message test warn array arg log capture capture log capture level warn object args object hello world log sf warn logger args equals hello world capture get message test log null pattern log capture capture log capture level error log sf log logger level error null math pi null capture get message test log no arg log capture capture log capture level error log sf log logger level error hello world math pi equals hello world capture get message test log bad pattern log capture capture log capture level error log sf log logger level error hello math pi equals hello capture get message test log missing arg log capture capture log capture level error log sf log logger level error hello world object equals hello world capture get message test log string log capture capture log capture level error log sf log logger level error hello world equals hello world capture get message test log null log capture capture log capture level error log sf log logger level error hello object null equals hello null capture get message test log log capture capture log capture level error val log sf log logger level error iteration val equals iteration capture get message test log log capture capture log capture level error val log sf log logger level error iteration val equals iteration capture get message test log log capture capture log capture level error val log sf log logger level error iteration val equals iteration capture get message test log log capture capture log capture level error val log sf log logger level error iteration val equals iteration capture get message test log log capture capture log capture level error val c log sf log logger level error iteration val equals iteration c capture get message test log log capture capture log capture level error val true log sf log logger level error iteration val equals iteration true capture get message test log log capture capture log capture level error log sf log logger level error iteration math pi string expected iteration string value of math pi equals expected capture get message test log log capture capture log capture level error log sf log logger level error iteration math pi string expected iteration string value of math pi equals expected capture get message test log two arg log capture capture log capture level error log sf log logger level error hello world equals hello world capture get message test log three arg log capture capture log capture level error log sf log logger level error hello world equals hello world capture get message test log four arg log capture capture log capture level error log sf log logger level error hello world equals hello world capture get message test log array arg log capture capture log capture level error object args object hello world log sf log logger level error args equals hello world capture get message string bundle name org apache log j test log sf patterns test logrb null bundle log capture capture log capture level error log sf logrb logger level error null iteration math pi equals iteration capture get message test logrb null key log capture capture log capture level error log sf logrb logger level error bundle name null math pi null capture get message test logrb no arg log capture capture log capture level error log sf logrb logger level error bundle name hello math pi equals hello world capture get message test logrb bad pattern log capture capture log capture level error log sf logrb logger level error bundle name malformed math pi equals hello capture get message test logrb missing arg log capture capture log capture level error log sf logrb logger level error bundle name hello object equals hello world capture get message test logrb string log capture capture log capture level error log sf logrb logger level error bundle name hello world equals hello world capture get message test logrb null log capture capture log capture level error log sf logrb logger level error bundle name hello object null equals hello null capture get message test logrb log capture capture log capture level error val log sf logrb logger level error bundle name iteration val equals iteration capture get message test logrb log capture capture log capture level error val log sf logrb logger level error bundle name iteration val equals iteration capture get message test logrb log capture capture log capture level error val log sf logrb logger level error bundle name iteration val equals iteration capture get message test logrb log capture capture log capture level error val log sf logrb logger level error bundle name iteration val equals iteration capture get message test logrb log capture capture log capture level error val c log sf logrb logger level error bundle name iteration val equals iteration c capture get message test logrb log capture capture log capture level error val true log sf logrb logger level error bundle name iteration val equals iteration true capture get message test logrb log capture capture log capture level error log sf logrb logger level error bundle name iteration math pi string expected iteration string value of math pi equals expected capture get message test logrb log capture capture log capture level error log sf logrb logger level error bundle name iteration math pi string expected iteration string value of math pi equals expected capture get message test logrb two arg log capture capture log capture level error log sf logrb logger level error bundle name hello hello world equals hello world capture get message test logrb three arg log capture capture log capture level error log sf logrb logger level error bundle name hello hello world equals hello world capture get message test logrb four arg log capture capture log capture level error log sf logrb logger level error bundle name hello hello world equals hello world capture get message test logrb array arg log capture capture log capture level error object args object hello world log sf logrb logger level error bundle name hello args equals hello world capture get message test escape one param log capture capture log capture level info log sf info logger world hello equals hello world capture get message test escape two param log capture capture log capture level info log sf info logger hello world equals hello world capture get message,12,12.4089,i test file message logger s suite exception pattern map
97,logger logger logger get logger org apache log j formatter test log xf tear down log manager reset configuration,14,1.0872,sf mf test layout file out system suite line map
98,bad stringifier instance bad stringifier to string null pointer exception test entering null null log capture capture log capture level debug logger set level level debug log xf entering logger null null equals null null entry capture get message test entering null null null log capture capture log capture level debug logger set level level debug log xf entering logger null null string null equals null null entry null capture get message test entering null null null array log capture capture log capture level debug logger set level level debug log xf entering logger null null object null equals null null entry capture get message test entering log capture capture log capture level debug logger set level level debug log xf entering logger some some method equals some some method entry capture get message test entering with param log capture capture log capture level debug logger set level level debug log xf entering logger some some method some param equals some some method entry some param capture get message test entering with bad param log capture capture log capture level debug logger set level level debug log xf entering logger some some method bad stringifier instance equals some some method entry capture get message test entering with bad params log capture capture log capture level debug logger set level level debug log xf entering logger some some method object param bad stringifier instance equals some some method entry param capture get message test exiting null null log capture capture log capture level debug logger set level level debug log xf exiting logger null null equals null null capture get message test exiting null null null log capture capture log capture level debug logger set level level debug log xf exiting logger null null string null equals null null null capture get message test exiting log capture capture log capture level debug logger set level level debug log xf exiting logger some some method equals some some method capture get message test exiting with value log capture capture log capture level debug logger set level level debug log xf exiting logger some some method some value equals some some method some value capture get message test exiting with bad value log capture capture log capture level debug logger set level level debug log xf exiting logger some some method bad stringifier instance equals some some method capture get message test throwing null null null log capture capture log capture level debug logger set level level debug log xf throwing logger null null null equals null null capture get message test throwing log capture capture log capture level debug logger set level level debug log xf throwing logger some some method illegal argument exception equals some some method capture get message,21,46.968,null some debug j thread socket capture method renderer async
99,create layout ttcc layout test format ndc clear ndc push ndc goes here logger logger logger get logger org apache log j layout test logging event event logging event org apache log j logger logger level info hello world null ttcc layout layout ttcc layout create layout string result layout format event ndc pop string buffer buf string buffer layout date format buf event buf append buf append event get thread name buf append buf append event get level to string buf append buf append event get logger name buf append buf append ndc goes here buf append buf append event get message buf append system get property line separator equals buf to string result test get set thread printing ttcc layout layout ttcc layout equals true layout get thread printing layout set thread printing false equals false layout get thread printing layout set thread printing true equals true layout get thread printing test get set category prefixing ttcc layout layout ttcc layout equals true layout get category prefixing layout set category prefixing false equals false layout get category prefixing layout set category prefixing true equals true layout get category prefixing test get set context printing ttcc layout layout ttcc layout equals true layout get context printing layout set context printing false equals false layout get context printing layout set context printing true equals true layout get context printing,2,19.0525,filter layout test exception pattern appender capture logger string root
100,perl util util perl util filter string pat filter absolute date and time pat util match pat in util substitute s filter absolute date and time pat in in util substitute s filter absolute date and time pat in in,37,5.5749,in priority util match filter some level exception date name
101,perl util util perl util filter string pat filter absolute time pat util match pat in util substitute s filter absolute time pat in in util substitute s filter absolute time pat in in,37,5.2572,in priority util match filter some level exception date name
102,b null b null compare buffered reader in buffered reader file reader file buffered reader in buffered reader file reader file string s line counter s in read line null line counter string s in read line s equals s system out println files file and file differ on line line counter system out println one reads s system out println other reads s false line counter string s in read line s equals s system out println files file and file differ on line line counter system out println one reads s system out println other reads s false system out println files file and file differ on line line counter system out println one reads s system out println other reads s false in read system out println file file longer than file file false system out println file file longer than file file false true open string resource name file name file name starts with witness resource name file name substring file name last index of resource name file name substring file name last index of input stream is test get resource as stream resource name is null file file file file name file exists is file input stream file file not found exception resource resource name not found file file file file name file exists is file input stream file file not found exception resource resource name not found is file input stream file file not found exception resource resource name not found is compare buffered reader in buffered reader file reader file buffered reader in buffered reader input stream reader open test file compare test file file in in in close in close compare test file file in in in close in close compare string s line counter s in read line null line counter string s in read line s equals s system out println files file and file differ on line line counter system out println one reads s system out println other reads s output file test file output file test file false line counter string s in read line s equals s system out println files file and file differ on line line counter system out println one reads s system out println other reads s output file test file output file test file false system out println files file and file differ on line line counter system out println one reads s system out println other reads s output file test file output file test file false in read system out println file file longer than file file output file test file output file test file false system out println file file longer than file file output file test file output file test file false true output file input stream is open test file buffered reader in buffered reader input stream reader is string s line counter system out println system out println contents of file s in read line null line counter system out print line counter line counter system out print line counter system out print line counter system out print system out print system out println s line counter system out print line counter line counter system out print line counter system out print line counter system out print system out print system out print system out print system out print system out print system out println s in close,12,59.9921,i test file message logger s suite exception pattern map
103,perl util util perl util string allowed patterns allowed patterns allowed patterns filter len allowed patterns length i i len i util match allowed patterns i in in util match allowed patterns i in in in unexpected format exception in,37,5.1641,in priority util match filter some level exception date name
