,context,dominant_topic,perc_contribution,topic_keywords
59,tear down log manager shutdown test simple basic configurator configure nt event log appender logger logger logger get logger org apache log j nt nt event log appender test i logger debug message i logger info message i logger warn message i logger error message i logger log level fatal message i logger debug message i exception just testing,2,5.1551,filter layout test exception pattern appender capture logger string root
60,ut object renderer aor ut object renderer bor ut object renderer xor ut object renderer yor ut object renderer oor ut object renderer nor ut object renderer ior ut object renderer cor ut object renderer sor set up aor ut object renderer a bor ut object renderer b xor ut object renderer x yor ut object renderer y oor ut object renderer object nor ut object renderer number ior ut object renderer integer cor ut object renderer comparable sor ut object renderer serializable test renderer map map renderer map object renderer dr map get renderer object renderer r map get integer equals r dr test renderer map map renderer map map put integer ior object renderer r map get integer equals r ior test renderer map map renderer map map put number ior object renderer r map get integer equals r ior test renderer map map renderer map map put object oor object renderer r map get integer equals r oor test renderer map map renderer map map put object oor map put number nor map put integer ior object renderer r map get integer equals r ior test renderer map map renderer map map put object oor map put number nor object renderer r map get integer equals r nor test renderer map map renderer map comparable null comparable name java lang comparable exception ex comparable name java lang comparable map put comparable cor object renderer r map get integer equals r cor test renderer map map renderer map map put serializable sor object renderer r map get integer equals r sor test renderer map map renderer map map put y yor object renderer r map get b equals r yor test renderer map map renderer map map put x xor object renderer r map get b equals r xor suite test suite suite test suite suite add test or test test suite add test or test test suite add test or test test suite add test or test test suite add test or test test suite add test or test test suite add test or test test suite add test or test test suite add test or test test suite add test or test test suite,12,41.6261,i test file message logger s suite exception pattern map
61,string name name name render name to string ut object renderer name,114,1.6285,array name bo render stream ut number catstr input li
62,create absolute time date format date format df simple date format hh mm ss sss df set time zone time zone df time zone gmt time zone get time zone gmt time zone chicago time zone get time zone america chicago test date format gmt format cached date format create absolute time date format gmt ticks l l date jul date ticks equals gmt format format jul date plus ms date ticks equals gmt format format plus ms date plus ms date ticks equals gmt format format plus ms date plus ms date ticks equals gmt format format plus ms date plus ms date ticks equals gmt format format plus ms test date jul date l l date format gmt format cached date format create absolute time date format gmt date format chicago format cached date format create absolute time date format chicago equals gmt format format jul equals chicago format format jul equals gmt format format jul test date format gmt format cached date format create absolute time date format gmt ticks l l date jul date ticks equals gmt format format jul date plus ms date ticks equals gmt format format plus ms date plus ms date ticks equals gmt format format plus ms date plus ms date ticks equals gmt format format plus ms date plus ms date ticks equals gmt format format plus ms test simple date format base format simple date format eee mmm dd hh mm ss sss z locale english date format cached format cached date format base format ticks l l date jul date ticks equals base format format jul cached format format jul date plus ms date ticks base format format plus ms cached format format plus ms equals base format format plus ms cached format format plus ms date plus ms date ticks equals base format format plus ms cached format format plus ms date plus ms date ticks equals base format format plus ms cached format format plus ms date plus ms date ticks equals base format format plus ms cached format format plus ms test locale thai locale th th simple date format base format simple date format eee mmm dd hh mm ss sss z thai date format cached format cached date format base format ticks l l string sx date jul date ticks sx cached format format jul system out println base format format jul system out println sx equals base format format jul sx sx cached format format jul system out println base format format jul system out println sx equals base format format jul sx date plus ms date ticks sx cached format format plus ms system out println base format format plus ms system out println sx equals base format format plus ms sx date plus ms date ticks equals base format format plus ms cached format format plus ms date plus ms date ticks equals base format format plus ms cached format format plus ms date plus ms date ticks equals base format format plus ms cached format format plus ms test not null cached date format simple date format get number format test date format base format simple date format yyyy mm dd hh mm ss sss base format set time zone gmt date format cached format cached date format base format date jul date l l equals cached format format jul cached format set time zone time zone get time zone gmt equals cached format format jul test date format base format simple date format yyyy mmmm dd hh mm ss ss z locale us date format cached format cached date format base format time zone cet time zone get time zone gmt cached format set time zone cet calendar c calendar get instance c set calendar december c set calendar second c set calendar millisecond c set time zone cet string expected base format format c get time string s cached format format c get time equals expected s c set calendar january c set calendar second c set calendar millisecond expected base format format c get time s cached format format c get time equals expected s test date format base format simple date format mmmm sss eeeeee locale us date format cached format cached date format base format time zone cet time zone get time zone gmt cached format set time zone cet calendar c calendar get instance c set calendar october c set calendar second c set calendar millisecond c set time zone cet string expected base format format c get time string s cached format format c get time equals expected s c set calendar november c set calendar millisecond expected base format format c get time s cached format format c get time equals expected s c set calendar millisecond expected base format format c get time s cached format format c get time equals expected s test string bad pattern ss ss simple date format simple format simple date format bad pattern simple date format base format simple date format bad pattern date format gmt format cached date format simple format gmt format set time zone gmt base format set time zone gmt ticks l l date jul date ticks string expected base format format jul equals expected gmt format format jul jul set time ticks expected base format format jul equals expected gmt format format jul test simple date format df simple date format yyyy mm dd hh mm ss sss ticks l l string formatted df format date ticks millisecond start cached date format find millisecond start ticks formatted df equals millisecond start test simple date format df simple date format yyyy mm dd ticks l l string formatted df format date ticks millisecond start cached date format find millisecond start ticks formatted df equals cached date format no milliseconds millisecond start test simple date format df simple date format hh mm ss sss ticks l l string formatted df format date ticks millisecond start cached date format find millisecond start ticks formatted df equals millisecond start test simple date format df simple date format hh mm ss s ticks l l string formatted df format date ticks millisecond start cached date format find millisecond start ticks formatted df equals cached date format unrecognized milliseconds millisecond start test simple date format df simple date format hh mm ss ss ticks l l string formatted df format date ticks millisecond start cached date format find millisecond start ticks formatted df equals cached date format unrecognized milliseconds millisecond start test date jul date l l string bad pattern hh mm ss sss hh mm ss sss simple date format simple format simple date format bad pattern simple format set time zone gmt date format cached format cached date format simple format string s cached format format jul equals s jul set time jul get time equals simple format format jul s cached format format jul max valid cached date format get maximum cache validity bad pattern equals max valid xsuite test suite suite test suite suite add test cached date format test test suite,3,278.5793,format date cached ms plus ticks time base jul appender
63,test get formatting info field formatting info get not null field equals field get min length equals integer max value field get max length equals false field is left aligned test constructor formatting info field formatting info true not null field equals field get min length equals field get max length equals true field is left aligned test truncate string buffer buf string buffer foobar formatting info field formatting info true field format buf equals fobar buf to string test pad left string buffer buf string buffer foobar formatting info field formatting info false field format buf equals fo obar buf to string test pad right string buffer buf string buffer foobar formatting info field formatting info true field format buf equals foobar buf to string,5,11.447,buf appender debug field start length logger string append abbrev
64,test get name abbreviator abbrev name abbreviator get abbreviator not null abbrev test zero name abbreviator abbrev name abbreviator get abbreviator string buffer buf string buffer debug field start buf length buf append org example foo bar abbrev abbreviate field start buf equals debug buf to string test blank name abbreviator abbrev name abbreviator get abbreviator name abbreviator abbrev name abbreviator get abbreviator true abbrev abbrev test one name abbreviator abbrev name abbreviator get abbreviator string buffer buf string buffer debug field start buf length buf append org example foo bar abbrev abbreviate field start buf equals debug bar buf to string buf set length buf append debug field start buf length buf append bar abbrev abbreviate field start buf equals debug bar buf to string buf set length buf append debug field start buf length abbrev abbreviate field start buf equals debug buf to string test blank one name abbreviator abbrev name abbreviator get abbreviator string buffer buf string buffer debug field start buf length buf append org example foo bar abbrev abbreviate field start buf equals debug bar buf to string buf set length buf append debug field start buf length buf append bar abbrev abbreviate field start buf equals debug bar buf to string buf set length buf append debug field start buf length abbrev abbreviate field start buf equals debug buf to string test two name abbreviator abbrev name abbreviator get abbreviator string buffer buf string buffer debug field start buf length buf append org example foo bar abbrev abbreviate field start buf equals debug foo bar buf to string buf set length buf append debug field start buf length buf append foo bar abbrev abbreviate field start buf equals debug foo bar buf to string buf set length buf append debug field start buf length buf append bar abbrev abbreviate field start buf equals debug bar buf to string test one dot name abbreviator abbrev name abbreviator get abbreviator string buffer buf string buffer debug field start buf length buf append org example foo bar abbrev abbreviate field start buf equals debug o e f bar buf to string buf set length buf append debug field start buf length buf append org example foo abbrev abbreviate field start buf equals debug o e f buf to string buf set length buf append debug field start buf length buf append foo bar abbrev abbreviate field start buf equals debug f bar buf to string buf set length buf append debug field start buf length buf append bar abbrev abbreviate field start buf equals debug bar buf to string buf set length buf append debug field start buf length abbrev abbreviate field start buf equals debug buf to string buf set length buf append debug field start buf length buf append abbrev abbreviate field start buf equals debug buf to string test one tilde dot name abbreviator abbrev name abbreviator get abbreviator string buffer buf string buffer debug field start buf length buf append org example foo bar abbrev abbreviate field start buf equals debug o e f bar buf to string buf set length buf append debug field start buf length buf append org example foo abbrev abbreviate field start buf equals debug o e f buf to string buf set length buf append debug field start buf length buf append foo bar abbrev abbreviate field start buf equals debug f bar buf to string buf set length buf append debug field start buf length buf append bar abbrev abbreviate field start buf equals debug bar buf to string buf set length buf append debug field start buf length abbrev abbreviate field start buf equals debug buf to string buf set length buf append debug field start buf length buf append abbrev abbreviate field start buf equals debug buf to string buf set length buf append debug field start buf length buf append o e f bar abbrev abbreviate field start buf equals debug o e f bar buf to string test multi name abbreviator abbrev name abbreviator get abbreviator string buffer buf string buffer debug field start buf length buf append org example foo bar abbrev abbreviate field start buf equals debug o example fo bar buf to string buf set length buf append debug field start buf length buf append org example foo abbrev abbreviate field start buf equals debug o example fo buf to string buf set length buf append debug field start buf length buf append foo bar abbrev abbreviate field start buf equals debug f bar buf to string buf set length buf append debug field start buf length buf append bar abbrev abbreviate field start buf equals debug bar buf to string buf set length buf append debug field start buf length abbrev abbreviate field start buf equals debug buf to string buf set length buf append debug field start buf length buf append abbrev abbreviate field start buf equals debug buf to string test minus one name abbreviator abbrev name abbreviator get abbreviator string buffer buf string buffer debug field start buf length buf append org example foo bar abbrev abbreviate field start buf equals debug example foo bar buf to string buf set length buf append debug field start buf length buf append bar abbrev abbreviate field start buf equals debug bar buf to string buf set length buf append debug field start buf length abbrev abbreviate field start buf equals debug buf to string buf set length buf append debug field start buf length buf append abbrev abbreviate field start buf equals debug buf to string,5,221.0698,buf appender debug field start length logger string append abbrev
65,num pattern converter instance num pattern converter instance instance format to append to append,104,1.2964,enhanced instance activate not options mock activated throwable ignores num
66,logger logger logger get logger org foobar logging event event event logging event org apache log j logger logger level info msg null convert list converters array list list fields array list pattern parser parse pattern converters fields registry pattern parser get pattern layout rules equals converters size fields size string buffer buf string buffer iterator converter iter converters iterator iterator field iter fields iterator converter iter has next field start buf length pattern converter converter iter next format event buf formatting info field iter next format field start buf field start buf length pattern converter converter iter next format event buf formatting info field iter next format field start buf buf to string test word hash map rule registry hash map rule registry put z num pattern converter get name string result convert z rule registry event equals result test word hash map rule registry hash map rule registry put n num pattern converter get name string result convert n rule registry event equals result test bogus word string result convert foobar null event equals foobar result test bogus word string result convert xyz foobar null event equals xyz foobar result test basic string result convert hello level m n null event equals hello info msg layout line sep result test basic string result convert relative level thread logger m n null event expected relative time event time stamp logging event get start time equals expected relative time info main logger get name msg layout line sep result test multi option string result convert d hh mm ss gmt d hh mm ss c m null event simple date format date format simple date format hh mm ss string local time date format format date event time stamp date format set time zone time zone get time zone gmt string utc time date format format date event time stamp string buffer buf string buffer utc time buf append buf append local time buf append org foobar msg equals buf to string result test bogus string result convert bogus null event equals bogus result test more string result convert more null event equals msg ore result test malformed option string result convert foo m yyyy mm dd null event equals foomsg yyyy mm dd result factories true rules size iterator iter rules values iterator factory sig name ljava lang string object factory arg object null iter has next rule iter next method factory rule get method instance factory sig object converter factory invoke null factory arg true converter null rule iter next method factory rule get method instance factory sig object converter factory invoke null factory arg true converter null test pattern layout factories factories pattern parser get pattern layout rules test file name pattern factories factories pattern parser get file name pattern rules,38,28.0346,result in threshold problem convert iter mdc time rule hierarchy
67,create layout pattern layout t p c m n test format logger logger logger get logger org apache log j layout test logging event event logging event org apache log j logger logger level info hello world null pattern layout layout pattern layout create layout string result layout format event string buffer buf string buffer buf append buf append event get thread name buf append buf append event get level to string buf append buf append event get logger name buf append buf append event get message buf append system get property line separator equals buf to string result test get pattern format pattern layout layout pattern layout create layout equals t p c m n layout get conversion pattern test conversion pattern equals m n pattern layout conversion pattern test ttcc conversion pattern equals r t p c x m n pattern layout ttcc conversion pattern test format resize logger logger logger get logger org apache log j xml pattern layout test ndc clear msg i i msg length i msg i a msg i a logging event event logging event org apache log j logger logger level debug string msg null pattern layout layout pattern layout create layout string result layout format event logging event event logging event org apache log j logger logger level warn hello world null result layout format event equals result substring,2,21.5734,filter layout test exception pattern appender capture logger string root
68,get buf size buf size get max capacity max capacity,4,1.2304,appender filter buf pattern equals exception logger get bf calendar
