,context,dominant_topic,perc_contribution,topic_keywords
19,string temp output temp string filtered output filtered string exception java lang exception just testing string exception s at string exception s at method unknown source string exception s at compiled code string pat main debug info warn error fatal message d string pat filter iso pat pat string pat filter absolute date and time pat pat string pat filter absolute time pat pat string pat filter relative time pat pat string pat main debug info warn error fatal message d string pat main debug info warn error fatal org apache log j enhanced pattern layout test common enhanced pattern layout test java d message d string pat a debug info warn error fatal main log j enhanced pattern layout test message d string pat b debug info warn error fatal main root message d string pat main debug info warn error fatal org apache log j enhanced pattern layout test common enhanced pattern layout test java d message d string pat main debug info warn error fatal apache log j enhanced pattern layout test common enhanced pattern layout test java d message d string pat trace debug info warn error fatal d message d string pat mdc logger root logger logger set up root logger get root logger logger logger get logger enhanced pattern layout test tear down root get logger repository reset configuration configure property configurator configure file name compare compare compare actual expected test configure input pattern enhanced pattern layout properties common transformer transform temp filtered filter enhanced line number filter sun reflect filter enhanced junit test runner filter true compare filtered witness pattern enhanced pattern layout test configure input pattern enhanced pattern layout properties common control filter cf control filter string pat exception exception exception transformer transform temp filtered filter cf enhanced line number filter iso filter sun reflect filter enhanced junit test runner filter true compare filtered witness pattern enhanced pattern layout test configure input pattern enhanced pattern layout properties common control filter cf control filter string pat exception exception exception transformer transform temp filtered filter cf enhanced line number filter iso filter sun reflect filter enhanced junit test runner filter true compare filtered witness pattern enhanced pattern layout test configure input pattern enhanced pattern layout properties common control filter cf control filter string pat exception exception exception transformer transform temp filtered filter cf enhanced line number filter absolute date and time filter sun reflect filter enhanced junit test runner filter true compare filtered witness pattern enhanced pattern layout test configure input pattern enhanced pattern layout properties common control filter cf control filter string pat exception exception exception transformer transform temp filtered filter cf enhanced line number filter absolute date and time filter sun reflect filter enhanced junit test runner filter true compare filtered witness pattern enhanced pattern layout test configure input pattern enhanced pattern layout properties common control filter cf control filter string pat exception exception exception transformer transform temp filtered filter cf enhanced line number filter absolute time filter sun reflect filter enhanced junit test runner filter true compare filtered witness pattern enhanced pattern layout test configure input pattern enhanced pattern layout properties common control filter cf control filter string pat exception exception exception transformer transform temp filtered filter cf enhanced line number filter absolute time filter sun reflect filter enhanced junit test runner filter true compare filtered witness pattern enhanced pattern layout test configure input pattern enhanced pattern layout properties common control filter cf control filter string pat exception exception exception transformer transform temp filtered filter cf enhanced line number filter relative time filter sun reflect filter enhanced junit test runner filter true compare filtered witness pattern enhanced pattern layout test configure input pattern enhanced pattern layout properties common control filter cf control filter string pat exception exception exception transformer transform temp filtered filter cf enhanced line number filter sun reflect filter enhanced junit test runner filter true compare filtered witness pattern enhanced pattern layout test configure input pattern enhanced pattern layout properties common control filter cf control filter string pat exception exception exception transformer transform temp filtered filter cf enhanced line number filter sun reflect filter enhanced junit test runner filter true compare filtered witness pattern enhanced pattern layout test configure input pattern enhanced pattern layout properties common control filter cf control filter string pat a pat b exception exception exception transformer transform temp filtered filter cf enhanced line number filter sun reflect filter enhanced junit test runner filter true compare filtered witness pattern enhanced pattern layout test configure input pattern enhanced pattern layout properties common control filter cf control filter string pat exception exception exception transformer transform temp filtered filter cf enhanced line number filter sun reflect filter enhanced junit test runner filter true compare filtered witness pattern enhanced pattern layout test configure input pattern enhanced pattern layout properties common control filter cf control filter string pat exception exception exception transformer transform temp filtered filter cf enhanced line number filter sun reflect filter enhanced junit test runner filter true compare filtered witness pattern enhanced pattern layout test configure input pattern enhanced pattern layout properties common transformer transform temp filtered filter enhanced line number filter sun reflect filter enhanced junit test runner filter true compare filtered witness pattern enhanced pattern layout clear mdc java util hashtable context mdc get context context null context clear context clear test mdc configure input pattern enhanced pattern layout mdc properties clear mdc mdc put key va mdc put key va logger debug hello world mdc remove key mdc remove key transformer transform temp filtered filter enhanced line number filter sun reflect filter enhanced junit test runner filter mdc order filter true compare filtered witness pattern enhanced pattern layout mdc test configure input pattern enhanced pattern layout properties common control filter cf control filter string pat exception exception exception exception transformer transform temp filtered filter cf enhanced line number filter sun reflect filter enhanced junit test runner filter true compare filtered witness pattern enhanced pattern layout test start date get time configure input pattern enhanced pattern layout properties common end date get time file reader reader file reader output pattern layout log chars reader read chars chars length reader close simple date format format simple date format yyyy mm dd hh mm ss format set time zone time zone get time zone gmt string utc str string chars date utc date format parse utc str parse position true utc date get time start utc date get time end string cst str string chars format set time zone time zone get time zone gmt date cst date format parse cst str parse position false cst str equals utc str true cst date get time start cst date get time end common i logger debug message i root debug message i logger info message i root info message i logger warn message i root warn message i logger error message i root error message i logger log level fatal message i root log level fatal message i exception e exception just testing logger debug message i e logger info message i e logger warn message i e logger error message i e logger log level fatal message i e test mdc string output file output pattern layout mdc string witness file witness pattern enhanced pattern layout mdc string mdc msg pattern m x n string mdc msg pattern m x key n string mdc msg pattern m x key n string mdc msg pattern m x key n string mdc msg pattern m x key x key x key n enhanced pattern layout layout enhanced pattern layout m n appender appender file appender layout output file false root add appender appender root set level level debug clear mdc root debug starting mdc pattern test layout set conversion pattern mdc msg pattern layout activate options root debug empty mdc no key specified in pattern layout set conversion pattern mdc msg pattern layout activate options root debug empty mdc key in pattern layout set conversion pattern mdc msg pattern layout activate options root debug empty mdc key in pattern layout set conversion pattern mdc msg pattern layout activate options root debug empty mdc key in pattern layout set conversion pattern mdc msg pattern layout activate options root debug empty mdc key key and key in pattern mdc put key value mdc put key value layout set conversion pattern mdc msg pattern layout activate options root debug filled mdc no key specified in pattern layout set conversion pattern mdc msg pattern layout activate options root debug filled mdc key in pattern layout set conversion pattern mdc msg pattern layout activate options root debug filled mdc key in pattern layout set conversion pattern mdc msg pattern layout activate options root debug filled mdc key in pattern layout set conversion pattern mdc msg pattern layout activate options root debug filled mdc key key and key in pattern mdc remove key mdc remove key layout set conversion pattern m n layout activate options root debug finished mdc pattern test transformer transform output file filtered filter enhanced line number filter sun reflect filter enhanced junit test runner filter mdc order filter true compare filtered witness file test throwable string output file output pattern layout throwable string witness file witness pattern enhanced pattern layout throwable enhanced pattern layout layout enhanced pattern layout m n appender appender file appender layout output file false root add appender appender root set level level debug root debug starting throwable pattern test exception ex exception test exception root debug plain pattern no exception root debug plain pattern with exception ex layout set conversion pattern m n throwable layout activate options root debug throwable no exception root debug throwable with exception ex layout set conversion pattern m n throwable layout activate options root debug throwable no exception root debug throwable with exception ex layout set conversion pattern m n throwable none layout activate options root debug throwable none no exception root debug throwable none with exception ex layout set conversion pattern m n throwable layout activate options root debug throwable no exception root debug throwable with exception ex layout set conversion pattern m n throwable layout activate options root debug throwable no exception root debug throwable with exception ex layout set conversion pattern m n throwable layout activate options root debug throwable no exception root debug throwable with exception ex string trace throwable information ex get throwable str rep layout set conversion pattern m n throwable trace length layout activate options root debug throwable n no exception root debug throwable n with exception ex transformer transform output file filtered filter enhanced line number filter sun reflect filter enhanced junit test runner filter mdc order filter true compare filtered witness file,2,227.4359,filter layout test exception pattern appender capture logger string root
20,test enhanced render throwable renderer r enhanced throwable renderer exception ex exception string str rep r render ex not null str rep true str rep length i i str rep length i not null str rep i not null str rep i,67,3.9123,str null at suite ipos junit value policy hierarchy n
21,test directory creation system get property java version starts with file file file output newdir temp log file delete file dir file output newdir dir delete org apache log j file appender wa org apache log j file appender wa set file output newdir temp log wa set layout pattern layout m n wa activate options true file output newdir temp log exists file file file output newdir temp log file delete file dir file output newdir dir delete org apache log j file appender wa org apache log j file appender wa set file output newdir temp log wa set layout pattern layout m n wa activate options true file output newdir temp log exists test get threshold type method method file appender get method get threshold null true method get type priority testget set threshold file appender appender file appender priority debug level debug null appender get threshold appender set threshold debug true appender get threshold debug test is as severe as threshold file appender appender file appender priority debug level debug true appender is as severe as threshold debug,2,10.7533,filter layout test exception pattern appender capture logger string root
22,logger cat logger get logger x max logging event e logging event max i i max i e i logging event cat level debug e i null e i logging event cat level debug e i null set up test size size size bounded fifo bf bounded fifo size equals bf get max size size null bf get i j k i i size i j j i j bf put e j equals bf length j size j size max size j size j j k k j k equals bf length max k max k object r bf get k size null r equals r e k bounded fifo bf bounded fifo size equals bf get max size size null bf get i j k i i size i j j i j bf put e j equals bf length j size j size max size j size j j k k j k equals bf length max k max k object r bf get k size null r equals r e k j j i j bf put e j equals bf length j size j size bf put e j equals bf length j size j size max size j size j j k k j k equals bf length max k max k object r bf get k size null r equals r e k equals bf length max k max k object r bf get k size null r equals r e k test size bounded fifo bf bounded fifo size bf put e equals bf get e null bf get bf put e equals bf length bf put e equals bf length bf put e equals bf length equals bf get e equals bf length equals bf get e equals bf length equals bf get e equals bf length null bf get equals bf length min a b a b test resize size n n size n i i size i bounded fifo bf bounded fifo size f f i f bf put e f bf resize n expected size min n min i size equals bf length expected size c c expected size c equals bf get e c i i size i bounded fifo bf bounded fifo size f f i f bf put e f bf resize n expected size min n min i size equals bf length expected size c c expected size c equals bf get e c bounded fifo bf bounded fifo size f f i f bf put e f bf put e f bf resize n expected size min n min i size equals bf length expected size c c expected size c equals bf get e c equals bf get e c test resize size n n size n i i size i d d min i size d bounded fifo bf bounded fifo size p p i p bf put e p g g d g bf get x bf length bf resize n expected size min n x equals bf length expected size c c expected size c equals bf get e c d null bf get i i size i d d min i size d bounded fifo bf bounded fifo size p p i p bf put e p g g d g bf get x bf length bf resize n expected size min n x equals bf length expected size c c expected size c equals bf get e c d null bf get d d min i size d bounded fifo bf bounded fifo size p p i p bf put e p g g d g bf get x bf length bf resize n expected size min n x equals bf length expected size c c expected size c equals bf get e c d null bf get bounded fifo bf bounded fifo size p p i p bf put e p bf put e p g g d g bf get bf get x bf length bf resize n expected size min n x equals bf length expected size c c expected size c equals bf get e c d equals bf get e c d null bf get test resize size n n size n i i size i d d i d r r d r bounded fifo bf bounded fifo size p p i p bf put e p g g d g bf get p p r p bf put e i p x bf length bf resize n expected size min n x equals bf length expected size c c expected size c equals bf get e c d i i size i d d i d r r d r bounded fifo bf bounded fifo size p p i p bf put e p g g d g bf get p p r p bf put e i p x bf length bf resize n expected size min n x equals bf length expected size c c expected size c equals bf get e c d d d i d r r d r bounded fifo bf bounded fifo size p p i p bf put e p g g d g bf get p p r p bf put e i p x bf length bf resize n expected size min n x equals bf length expected size c c expected size c equals bf get e c d r r d r bounded fifo bf bounded fifo size p p i p bf put e p g g d g bf get p p r p bf put e i p x bf length bf resize n expected size min n x equals bf length expected size c c expected size c equals bf get e c d bounded fifo bf bounded fifo size p p i p bf put e p g g d g bf get p p r p bf put e i p x bf length bf resize n expected size min n x equals bf length expected size c c expected size c equals bf get e c d equals bf get e c d suite test suite suite test suite suite add test bounded fifo test test suite add test bounded fifo test test suite add test bounded fifo test test resize suite add test bounded fifo test test resize suite add test bounded fifo test test resize suite,4,84.6632,appender filter buf pattern equals exception logger get bf calendar
23,logger cat logger get logger x max logging event e logging event max i i max i e i logging event cat level debug e i null e i logging event cat level debug e i null set up test size cyclic buffer cb cyclic buffer size equals cb get max size size cb add e equals cb length equals cb get e equals cb length null cb get equals cb length cb cyclic buffer size cb add e cb add e equals cb length equals cb get e equals cb length equals cb get e equals cb length null cb get equals cb length test buf size buf size buf size test buf size test cyclic buffer cb cyclic buffer size equals cb get max size size i size i size i null cb get i null cb get i i i max i cb add e i limit i size i size j limit j j equals cb get j e i limit j null cb get null cb get limit cb add e i limit i size i size j limit j j equals cb get j e i limit j equals cb get j e i limit j null cb get null cb get limit test resize isize isize isize test resize isize isize isize test resize isize isize isize test resize isize isize isize test resize isize isize isize test resize isize isize isize test resize isize isize isize test resize isize isize isize test resize isize isize isize test resize cyclic buffer cb cyclic buffer initial size i i number of adds i cb add e i cb add e i cb resize size offset number of adds initial size offset offset len size number of adds size number of adds len len initial size len initial size j j len j equals cb get j e offset j equals cb get j e offset j suite test suite suite test suite suite add test cyclic buffer test test suite add test cyclic buffer test test suite add test cyclic buffer test test resize suite,24,24.053,s stream string logger cb skip equals actual root end
24,create layout mock layout test null date format equals null date layout null date format test relative time date format equals relative date layout relative time date format test date format option equals date format date layout date format option test time zone option equals time zone date layout timezone option test get option strings string options date layout create layout get option strings equals options length test set option date format date layout layout date layout create layout layout set option d atef ormat foobar equals foobar layout get date format test set option time zone date layout layout date layout create layout layout set option t imez one equals layout get time zone test set date format date layout layout date layout create layout layout set date format absolute equals absolute layout get date format test set time zone date layout layout date layout create layout layout set time zone equals layout get time zone test set date format null date layout layout date layout create layout layout set date format string null null test set date format null string date layout layout date layout create layout layout set date format nu ll null test set date format relative date layout layout date layout create layout layout set date format r elat ive time zone get test set date format absolute date layout layout date layout create layout layout set date format a bsol ute time zone get test set date format date time date layout layout date layout create layout layout set date format d ate time zone get test set date format iso date layout layout date layout create layout layout set date format i so time zone get test set date format simple date layout layout date layout create layout layout set date format hh mm ss time zone get test activate options date layout layout date layout create layout layout set date format hh mm ss layout set time zone layout activate options test set date format with format date format format simple date format hh mm date layout layout date layout create layout layout set date format format time zone get test iso format date format format iso date format calendar calendar calendar get instance calendar clear calendar set string actual format format calendar get time equals actual test date time format date format format date time date format calendar calendar calendar get instance calendar clear calendar set string actual format format calendar get time simple date format df simple date format dd mmm yyyy hh mm ss sss string expected df format calendar get time equals expected actual,3,76.872,format date cached ms plus ticks time base jul appender
25,not null pos not null date null date format format mock activate options ignores throwable true,3,2.3442,format date cached ms plus ticks time base jul appender
26,test debug key equals log j debug log log debug key test config debug key equals log j config debug log log config debug key,92,2.7669,config write timestamp debug nasty p rep activated configuration lethal
27,properties props set up props properties props put toto wonderful props put key value props put key value props put line separator system get property line separator props put java home system get property java home system set properties props tear down props null log manager reset configuration var subst test string r r option converter subst vars hello world null equals hello world r r option converter subst vars hello toto world null equals hello wonderful world r var subst test string r r option converter subst vars test key mid key end null equals test value mid value end r var subst test string r r option converter subst vars test unset mid key end null equals test mid value end r var subst test string val test incomplete option converter subst vars val null illegal argument exception e string error msg e get message equals val has no closing brace opening brace at position error msg option converter subst vars val null string error msg e get message equals val has no closing brace opening brace at position error msg var subst test properties props properties props put p x props put p p string res option converter subst vars p props system out println result is res equals res x test input stream file file file input filter properties true file exists file input stream input stream file input stream file option converter select and configure input stream null log manager get logger repository input stream close option converter select and configure input stream null log manager get logger repository input stream close property configurator test get get name validate nested to level test string val info level p option converter to level val null equals p level info to level test string val info org apache log j xml x level level p option converter to level val null equals p level info to level test string val trace org apache log j xml x level level p option converter to level val null equals p x level trace to level test string val tr org apache log j xml x level level p option converter to level val null equals p null to level test string val info org apache log j xml toto level p option converter to level val null equals p null suite test suite suite test suite suite add test option converter test var subst test suite add test option converter test var subst test suite add test option converter test var subst test suite add test option converter test var subst test suite add test option converter test var subst test suite add test option converter test test input stream suite add test option converter test to level test suite add test option converter test to level test suite add test option converter test to level test suite add test option converter test to level test suite add test option converter test to level test suite,12,41.2874,i test file message logger s suite exception pattern map
